"text","favorited","favoriteCount","replyToSN","created","truncated","replyToSID","id","replyToUID","statusSource","screenName","retweetCount","isRetweet","retweeted","longitude","latitude"
"Touchdown iPhone 7! First photos on @SInow https://t.co/BHXoA83ZgU",FALSE,4309,NA,2016-09-11 23:38:51,FALSE,NA,"775116424171941888",NA,"<a href=""http://twitter.com/download/iphone"" rel=""nofollow"">Twitter for iPhone</a>","tim_cook",2026,FALSE,FALSE,NA,NA
"What a day! 
https://t.co/0q61M9J3gp",FALSE,5730,NA,2016-09-08 01:54:13,FALSE,NA,"773700941996433409",NA,"<a href=""http://twitter.com"" rel=""nofollow"">Twitter Web Client</a>","tim_cook",2208,FALSE,FALSE,NA,NA
"Thanks to Olympians @ryan_f_murphy @nathangadrian @KathleenBaker2 @SwimHaley @MJGold for joining today #AppleEvent! https://t.co/rtn4PWYq7K",FALSE,3684,NA,2016-09-07 22:10:35,FALSE,NA,"773644659469918209",NA,"<a href=""http://twitter.com/download/iphone"" rel=""nofollow"">Twitter for iPhone</a>","tim_cook",764,FALSE,FALSE,NA,NA
"Sun's coming up in San Francisco and we are ready for a big day! https://t.co/PgLZN7ZcrQ",FALSE,22126,NA,2016-09-07 14:37:20,FALSE,NA,"773530595284529152",NA,"<a href=""http://twitter.com/download/iphone"" rel=""nofollow"">Twitter for iPhone</a>","tim_cook",9454,FALSE,FALSE,NA,NA
"¡Hola Mexico! ¡Vengan a celebrar! https://t.co/Zpk2xPyERI https://t.co/UkaLsq5Wj6",FALSE,4054,NA,2016-09-02 03:58:37,FALSE,NA,"771557920572002304",NA,"<a href=""http://twitter.com/download/iphone"" rel=""nofollow"">Twitter for iPhone</a>","tim_cook",1949,FALSE,FALSE,NA,NA
"Vicini con affetto e con il cuore rivolto alle vittime. <U+0001F1EE><U+0001F1F9>",FALSE,5617,NA,2016-08-24 05:13:17,FALSE,NA,"768315220703924225",NA,"<a href=""http://twitter.com/#!/download/ipad"" rel=""nofollow"">Twitter for iPad</a>","tim_cook",2246,FALSE,FALSE,NA,NA
"We owe @NatlParkService a debt of gratitude<U+0001F44F><U+0001F44F> for 100 amazing years. <U+0001F389><U+0001F389> by hiking @YellowstoneNPS @GrandTetonNPS https://t.co/PGGwukKRto",FALSE,5085,NA,2016-08-07 14:03:09,FALSE,NA,"762287969235443713",NA,"<a href=""http://twitter.com/download/iphone"" rel=""nofollow"">Twitter for iPhone</a>","tim_cook",1118,FALSE,FALSE,NA,NA
".@AppStore developers have now earned over $50 billion! Congratulations on your success and such inspired creativity.",FALSE,4865,NA,2016-08-03 20:05:35,FALSE,NA,"760929629226041345",NA,"<a href=""http://twitter.com/#!/download/ipad"" rel=""nofollow"">Twitter for iPad</a>","tim_cook",1657,FALSE,FALSE,NA,NA
"July was a record-breaker for the @AppStore! Highest-ever monthly billings and money paid to developers.",FALSE,2739,NA,2016-08-03 20:04:51,FALSE,NA,"760929444886351872",NA,"<a href=""http://twitter.com/#!/download/ipad"" rel=""nofollow"">Twitter for iPad</a>","tim_cook",852,FALSE,FALSE,NA,NA
"Thanks to everyone who joined the grand opening of our new store in Brooklyn, and congrats to our team! https://t.co/6HZWM5yRsY",FALSE,2705,NA,2016-07-31 01:09:38,FALSE,NA,"759556594837225474",NA,"<a href=""http://twitter.com/#!/download/ipad"" rel=""nofollow"">Twitter for iPad</a>","tim_cook",567,FALSE,FALSE,NA,NA
"Wir sind bestürzt über die Ereignisse in München. Unsere Gedanken sind bei allen Menschen in der Stadt. <U+0001F1E9><U+0001F1EA> #Munich",FALSE,3876,NA,2016-07-22 22:42:14,FALSE,NA,"756620395168407552",NA,"<a href=""http://twitter.com/download/iphone"" rel=""nofollow"">Twitter for iPhone</a>","tim_cook",1160,FALSE,FALSE,NA,NA
"La France est dans nos coeurs et nos pensées. <U+0001F1EB><U+0001F1F7> #Nice",FALSE,6241,NA,2016-07-14 23:16:47,FALSE,NA,"753729989816688640",NA,"<a href=""http://twitter.com/download/iphone"" rel=""nofollow"">Twitter for iPhone</a>","tim_cook",3359,FALSE,FALSE,NA,NA
"Yes, coding CAN be fun! Your kids (and you) are going to love Swift Playgrounds!  https://t.co/rvzE0CLuZs",FALSE,2371,NA,2016-07-14 20:28:44,FALSE,NA,"753687695398797313",NA,"<a href=""http://twitter.com/download/iphone"" rel=""nofollow"">Twitter for iPhone</a>","tim_cook",931,FALSE,FALSE,NA,NA
"Proud of our talented team dedicated to providing #accessibility for all users https://t.co/rhDF5ks094",FALSE,2333,NA,2016-07-10 18:19:00,FALSE,NA,"752205497390931968",NA,"<a href=""http://twitter.com/download/iphone"" rel=""nofollow"">Twitter for iPhone</a>","tim_cook",986,FALSE,FALSE,NA,NA
"""We must all learn to live together as brothers, or we will all perish together as fools.” - Dr. Martin Luther King Jr.",FALSE,9890,NA,2016-07-08 14:15:29,FALSE,NA,"751419437761253376",NA,"<a href=""http://twitter.com/download/iphone"" rel=""nofollow"">Twitter for iPhone</a>","tim_cook",5277,FALSE,FALSE,NA,NA
"Our hearts go out to the families of the fallen officers and the entire #Dallas community. Justice cannot be gained through violence.",FALSE,4250,NA,2016-07-08 14:14:35,FALSE,NA,"751419213122678784",NA,"<a href=""http://twitter.com/download/iphone"" rel=""nofollow"">Twitter for iPhone</a>","tim_cook",1358,FALSE,FALSE,NA,NA
"Senseless killings this week remind us that justice is still out of reach for many. We can and must do better. https://t.co/pmYrTz6tA6",FALSE,4157,NA,2016-07-08 02:50:47,FALSE,NA,"751247130048630784",NA,"<a href=""http://twitter.com/download/iphone"" rel=""nofollow"">Twitter for iPhone</a>","tim_cook",1981,FALSE,FALSE,NA,NA
"Wishing everyone a safe &amp; happy #IndependenceDay <U+0001F1FA><U+0001F1F8> ""We hold these truths to be self-evident, that all men are created equal.""",FALSE,4132,NA,2016-07-04 14:14:07,FALSE,NA,"749969543112437761",NA,"<a href=""http://twitter.com/download/iphone"" rel=""nofollow"">Twitter for iPhone</a>","tim_cook",1194,FALSE,FALSE,NA,NA
"Dualarimiz Türk halki için #Istanbul <U+0001F1F9><U+0001F1F7>",FALSE,25172,NA,2016-06-28 22:07:54,FALSE,NA,"747914447159595008",NA,"<a href=""http://twitter.com/download/iphone"" rel=""nofollow"">Twitter for iPhone</a>","tim_cook",10158,FALSE,FALSE,NA,NA
"Happy Pride to everyone who turned out this weekend to celebrate! #applepride #pride2016 https://t.co/3GZlc9s6bl",FALSE,6162,NA,2016-06-26 22:06:43,FALSE,NA,"747189372462600192",NA,"<a href=""http://twitter.com/#!/download/ipad"" rel=""nofollow"">Twitter for iPad</a>","tim_cook",1531,FALSE,FALSE,NA,NA
"It’s Day 4 of #WWDC2016 in San Francisco. Hope everyone is having a great week! https://t.co/Y4zN5HQJYm",FALSE,3644,NA,2016-06-16 13:42:48,FALSE,NA,"743438680962961408",NA,"<a href=""http://twitter.com/download/iphone"" rel=""nofollow"">Twitter for iPhone</a>","tim_cook",811,FALSE,FALSE,NA,NA
"Our hearts go out to the victims of the unspeakable tragedy in #Orlando, their families and all who grieve with them.",FALSE,7781,NA,2016-06-12 15:56:25,FALSE,NA,"742022755445440512",NA,"<a href=""http://twitter.com/#!/download/ipad"" rel=""nofollow"">Twitter for iPad</a>","tim_cook",3087,FALSE,FALSE,NA,NA
".@laurenepowell: ""We reject the notion that any group of students should be considered beyond help” https://t.co/cNv3JOsggg",FALSE,1199,NA,2016-06-12 03:38:04,FALSE,NA,"741836943810404352",NA,"<a href=""http://twitter.com/#!/download/ipad"" rel=""nofollow"">Twitter for iPad</a>","tim_cook",336,FALSE,FALSE,NA,NA
"""He who is not courageous enough to take risks will accomplish nothing in life."" Rest in peace #MuhammadAli",FALSE,14180,NA,2016-06-04 04:35:08,FALSE,NA,"738952202799058945",NA,"<a href=""http://twitter.com/download/iphone"" rel=""nofollow"">Twitter for iPhone</a>","tim_cook",9488,FALSE,FALSE,NA,NA
"Reflecting on the sacrifices made by our fallen service members and their families in the name of freedom. #MemorialDay",FALSE,2966,NA,2016-05-30 13:30:05,FALSE,NA,"737274886062624768",NA,"<a href=""http://twitter.com/download/iphone"" rel=""nofollow"">Twitter for iPhone</a>","tim_cook",863,FALSE,FALSE,NA,NA
"Inspiring day hiking @YosemiteNPS. Hats off to the Park Service. https://t.co/lurhM3LESy",FALSE,6239,NA,2016-05-29 03:10:22,FALSE,NA,"736756543685812225",NA,"<a href=""http://twitter.com/download/iphone"" rel=""nofollow"">Twitter for iPhone</a>","tim_cook",1158,FALSE,FALSE,NA,NA
"Great energy, great entrepreneurs at @startupfesteu this morning. Amsterdam, dank je wel en tot ziens! https://t.co/XVJY4DKAlZ",FALSE,2635,NA,2016-05-24 11:00:46,FALSE,NA,"735062983659945984",NA,"<a href=""http://twitter.com/download/iphone"" rel=""nofollow"">Twitter for iPhone</a>","tim_cook",760,FALSE,FALSE,NA,NA
"Thanks @annefrankhouse for keeping her memory alive. We must never forget the terrible lessons of discrimination. https://t.co/iMkHdwz2P9",FALSE,1830,NA,2016-05-23 13:40:11,FALSE,NA,"734740714882400256",NA,"<a href=""http://twitter.com/download/iphone"" rel=""nofollow"">Twitter for iPhone</a>","tim_cook",557,FALSE,FALSE,NA,NA
"An inspiring visit with @assistiveware in Amsterdam. Their apps improve lives by giving people a voice. https://t.co/mrcR3dfbrj",FALSE,2176,NA,2016-05-23 11:54:59,FALSE,NA,"734714240561352704",NA,"<a href=""http://twitter.com/download/iphone"" rel=""nofollow"">Twitter for iPhone</a>","tim_cook",553,FALSE,FALSE,NA,NA
"A quick visit with customers and our fantastic team at the Apple Store, Mall of the Emirates. Thanks Dubai! https://t.co/utFFVGyImr",FALSE,3875,NA,2016-05-21 14:49:54,FALSE,NA,"734033482347843584",NA,"<a href=""http://twitter.com/#!/download/ipad"" rel=""nofollow"">Twitter for iPad</a>","tim_cook",1106,FALSE,FALSE,NA,NA
"Thanks PM @narendramodi for a great meeting. Already looking forward to next visit to India. Best wishes on the app! https://t.co/ctXiKoCiS0",FALSE,2561,NA,2016-05-21 06:48:53,FALSE,NA,"733912428342214656",NA,"<a href=""http://twitter.com/download/iphone"" rel=""nofollow"">Twitter for iPhone</a>","tim_cook",1099,FALSE,FALSE,NA,NA
"Lots of talent and enthusiasm at the new Mac Lab at GNITS women’s college. Enjoyed visiting you yesterday! https://t.co/ZqCnVkBpii",FALSE,5135,NA,2016-05-20 05:23:21,FALSE,NA,"733528516235431936",NA,"<a href=""http://twitter.com/download/iphone"" rel=""nofollow"">Twitter for iPhone</a>","tim_cook",1291,FALSE,FALSE,NA,NA
"RT @lisapjackson: Powerful: Visiting amazing solar mamas in Rajastan and visiting a school using iPads to teach..   @BarefootCollege https:…",FALSE,0,NA,2016-05-19 06:36:28,FALSE,NA,"733184530622865408",NA,"<a href=""http://twitter.com/download/iphone"" rel=""nofollow"">Twitter for iPhone</a>","tim_cook",332,TRUE,FALSE,NA,NA
"Great to hear from some of India's top iOS developers today. Innovative apps and many ideas for the future! https://t.co/ZhEfE7wNW7",FALSE,5993,NA,2016-05-18 13:01:16,FALSE,NA,"732918979816263680",NA,"<a href=""http://twitter.com/download/iphone"" rel=""nofollow"">Twitter for iPhone</a>","tim_cook",2053,FALSE,FALSE,NA,NA
"Here's the incredibly talented @JJ_Lin on the erhu as we jam with the new GarageBand, out today. https://t.co/RHJZuahLHi #shotoniphone",FALSE,1524,NA,2016-05-17 01:01:16,FALSE,NA,"732375399548735488",NA,"<a href=""http://twitter.com/download/iphone"" rel=""nofollow"">Twitter for iPhone</a>","tim_cook",534,FALSE,FALSE,NA,NA
"""Taxi!"" Caught a cab in Beijing this morning with Didi Chuxing's Jean Liu. https://t.co/Sl2xnzXtNY",FALSE,4154,NA,2016-05-16 03:51:49,FALSE,NA,"732055931974864896",NA,"<a href=""http://twitter.com/download/iphone"" rel=""nofollow"">Twitter for iPhone</a>","tim_cook",1110,FALSE,FALSE,NA,NA
"Looking forward to working with @BillRMcDermott @SAP on new iPhone &amp; iPad apps. https://t.co/7QcMCEiPKY https://t.co/iRZzEZ3EPR",FALSE,2275,NA,2016-05-05 19:46:09,FALSE,NA,"728309830138499072",NA,"<a href=""http://twitter.com/download/iphone"" rel=""nofollow"">Twitter for iPhone</a>","tim_cook",952,FALSE,FALSE,NA,NA
"Powering your iMessages with 100% renewable energy - because our planet deserves our best thinking. #EarthDay <U+0001F30E> https://t.co/ze7rNObMGM",FALSE,3650,NA,2016-04-22 16:44:16,FALSE,NA,"723553013453844481",NA,"<a href=""http://twitter.com/download/iphone"" rel=""nofollow"">Twitter for iPhone</a>","tim_cook",1759,FALSE,FALSE,NA,NA
"Prince was a true innovator and a singular artist. His music and influence will live on for generations. Rest in peace.",FALSE,6956,NA,2016-04-21 17:52:05,FALSE,NA,"723207693716975616",NA,"<a href=""http://twitter.com/download/iphone"" rel=""nofollow"">Twitter for iPhone</a>","tim_cook",3117,FALSE,FALSE,NA,NA
"Our thinnest and lightest Mac, now better than ever. Meet the new #MacBook. https://t.co/NCs226jGtI https://t.co/3eK7oy4wpr",FALSE,6446,NA,2016-04-19 14:18:07,FALSE,NA,"722429070525534208",NA,"<a href=""http://twitter.com/#!/download/ipad"" rel=""nofollow"">Twitter for iPad</a>","tim_cook",2936,FALSE,FALSE,NA,NA
"Bill Campbell believed in Apple when few people did. We'll miss his wisdom,friendship,humor &amp; his love for life. RIP https://t.co/HA7hYgGxNM",FALSE,5395,NA,2016-04-18 19:16:34,FALSE,NA,"722141792490029056",NA,"<a href=""http://twitter.com/download/iphone"" rel=""nofollow"">Twitter for iPhone</a>","tim_cook",1829,FALSE,FALSE,NA,NA
"Our hearts and thoughts are with everyone affected by terrifying earthquakes in recent days. #FuerzaEcuador #prayforkyushu #prayformyanmar",FALSE,3253,NA,2016-04-18 00:55:34,FALSE,NA,"721864716247633920",NA,"<a href=""http://twitter.com/download/iphone"" rel=""nofollow"">Twitter for iPhone</a>","tim_cook",1358,FALSE,FALSE,NA,NA
"Proud to support @World_Wildlife with #AppsforEarth. Together we can help leave the world better than we found it. https://t.co/mUdGTSw2Pb",FALSE,2205,NA,2016-04-14 17:32:00,FALSE,NA,"720665926664728576",NA,"<a href=""http://twitter.com/download/iphone"" rel=""nofollow"">Twitter for iPhone</a>","tim_cook",960,FALSE,FALSE,NA,NA
"""We are capable of so much, if we just open our minds."" We can all learn from Dillan about #AutismAcceptance https://t.co/Zhy4lVPbB4",FALSE,2879,NA,2016-04-02 17:40:54,FALSE,NA,"716319508516839425",NA,"<a href=""http://twitter.com/#!/download/ipad"" rel=""nofollow"">Twitter for iPad</a>","tim_cook",1413,FALSE,FALSE,NA,NA
"Happy Birthday, Apple! Celebrating 40 years &amp; looking forward to many more decades of innovation. @zanelowe https://t.co/5lUDP1cAjw",FALSE,14777,NA,2016-04-02 02:15:44,FALSE,NA,"716086686342455300",NA,"<a href=""http://twitter.com/#!/download/ipad"" rel=""nofollow"">Twitter for iPad</a>","tim_cook",6524,FALSE,FALSE,NA,NA
"Congrats to all the new iPhone SE and iPad Pro owners! I hope you love them as much as we do. https://t.co/harfwjywJ0",FALSE,6390,NA,2016-03-31 22:24:29,FALSE,NA,"715666100508168193",NA,"<a href=""http://twitter.com/#!/download/ipad"" rel=""nofollow"">Twitter for iPad</a>","tim_cook",1660,FALSE,FALSE,NA,NA
"Our thoughts and prayers are with our friends, customers, coworkers and all the people of Belgium.",FALSE,5672,NA,2016-03-22 19:23:42,FALSE,NA,"712359112806309888",NA,"<a href=""http://twitter.com"" rel=""nofollow"">Twitter Web Client</a>","tim_cook",1786,FALSE,FALSE,NA,NA
"Andy Grove was one of the giants of the technology world. He loved our country and epitomized America at its best. Rest in peace.",FALSE,4186,NA,2016-03-22 00:29:06,FALSE,NA,"712073584194105344",NA,"<a href=""http://twitter.com"" rel=""nofollow"">Twitter Web Client</a>","tim_cook",1840,FALSE,FALSE,NA,NA
"Happy 10th Birthday @jack and everyone @twitter!  <U+0001F389><U+0001F388>Thanks for giving all of us the ultimate megaphone.",FALSE,9261,NA,2016-03-21 00:39:11,FALSE,NA,"711713733299404800",NA,"<a href=""http://twitter.com/download/iphone"" rel=""nofollow"">Twitter for iPhone</a>","tim_cook",4127,FALSE,FALSE,NA,NA
"Thank you, James, for sharing your inspiring story. https://t.co/gyjqubL0Ji",FALSE,3022,NA,2016-03-17 02:50:56,FALSE,NA,"710297335431966721",NA,"<a href=""http://twitter.com/#!/download/ipad"" rel=""nofollow"">Twitter for iPad</a>","tim_cook",1343,FALSE,FALSE,NA,NA
"We’re always looking for new ways to help you get the most from <U+F8FF> products. Meet @AppleSupport! https://t.co/YhdvY44PPS",FALSE,3649,NA,2016-03-03 20:37:46,FALSE,NA,"705492384570716160",NA,"<a href=""http://twitter.com/download/iphone"" rel=""nofollow"">Twitter for iPhone</a>","tim_cook",1609,FALSE,FALSE,NA,NA
"Remembering Steve on his 61st birthday. ""Let's go invent tomorrow."" https://t.co/UGYMcohsf0",FALSE,17938,NA,2016-02-24 14:14:19,FALSE,NA,"702496781695787008",NA,"<a href=""http://twitter.com/#!/download/ipad"" rel=""nofollow"">Twitter for iPad</a>","tim_cook",10589,FALSE,FALSE,NA,NA
"Rest in peace, Harper Lee. ""The one thing that doesn't abide by majority rule is a person's conscience.""",FALSE,5068,NA,2016-02-19 16:04:34,FALSE,NA,"700712587994861568",NA,"<a href=""http://twitter.com"" rel=""nofollow"">Twitter Web Client</a>","tim_cook",3072,FALSE,FALSE,NA,NA
"Happy #PresidentsDay!  ""I will prepare and someday my chance will come""--Abraham Lincoln",FALSE,2605,NA,2016-02-15 16:16:59,FALSE,NA,"699266163428032512",NA,"<a href=""http://twitter.com"" rel=""nofollow"">Twitter Web Client</a>","tim_cook",790,FALSE,FALSE,NA,NA
"Congrats @Millerlite40 Peyton Manning @Broncos Amazing season. https://t.co/3RfQml832C",FALSE,2822,NA,2016-02-08 05:56:45,FALSE,NA,"696573360965222404",NA,"<a href=""http://twitter.com/#!/download/ipad"" rel=""nofollow"">Twitter for iPad</a>","tim_cook",650,FALSE,FALSE,NA,NA
"Great to meet talented Italian developers today with @matteorenzi in Rome https://t.co/2DcRPMYNHD",FALSE,2941,NA,2016-01-22 15:57:38,FALSE,NA,"690563984106328064",NA,"<a href=""http://twitter.com/download/iphone"" rel=""nofollow"">Twitter for iPhone</a>","tim_cook",1018,FALSE,FALSE,NA,NA
"Apple has created over 1.4m jobs across Europe <U+0001F1EA><U+0001F1FA> and we're announcing a center for aspiring iOS developers in Italy https://t.co/v9RLYX6u6u",FALSE,3722,NA,2016-01-21 12:17:11,FALSE,NA,"690146117451943936",NA,"<a href=""http://twitter.com/download/iphone"" rel=""nofollow"">Twitter for iPhone</a>","tim_cook",1850,FALSE,FALSE,NA,NA
"Proud to volunteer beside hundreds of Apple employees honoring #MLKDay at ConnectED partner Santee Elementary. https://t.co/3EOmcPkovh",FALSE,2067,NA,2016-01-18 21:23:38,FALSE,NA,"689196473188143104",NA,"<a href=""http://twitter.com/#!/download/ipad"" rel=""nofollow"">Twitter for iPad</a>","tim_cook",515,FALSE,FALSE,NA,NA
"Remembering #MLK and his timeless words.  We should never forget. https://t.co/b8kXa4ZFZ1",FALSE,3478,NA,2016-01-18 16:18:49,FALSE,NA,"689119762626904064",NA,"<a href=""http://twitter.com"" rel=""nofollow"">Twitter Web Client</a>","tim_cook",1908,FALSE,FALSE,NA,NA
"Remembering #MLK:  Life's most persistent and urgent question is ""What are you doing for others?""",FALSE,2193,NA,2016-01-18 16:06:59,FALSE,NA,"689116785929490433",NA,"<a href=""http://twitter.com"" rel=""nofollow"">Twitter Web Client</a>","tim_cook",1190,FALSE,FALSE,NA,NA
"¡Hola México! ¡Feliz de abrir una tienda pronto en su país!
 https://t.co/HYBUaSWMcq",FALSE,3991,NA,2016-01-09 02:15:49,FALSE,NA,"685646125261438976",NA,"<a href=""http://twitter.com/#!/download/ipad"" rel=""nofollow"">Twitter for iPad</a>","tim_cook",2325,FALSE,FALSE,NA,NA
"#HappyNewYear to every corner of the world<U+0001F389> Wishing everyone more music, less noise <U+0001F64F>.",FALSE,6114,NA,2016-01-01 16:11:53,FALSE,NA,"682957426224574464",NA,"<a href=""http://twitter.com/download/iphone"" rel=""nofollow"">Twitter for iPhone</a>","tim_cook",2012,FALSE,FALSE,NA,NA
"Congrats on a great finish to the season!  I'm already looking forward to next year @FootballAU @CoachGusMalzahn #WarEagle",FALSE,1794,NA,2015-12-30 20:17:22,FALSE,NA,"682294427377876992",NA,"<a href=""http://twitter.com/#!/download/ipad"" rel=""nofollow"">Twitter for iPad</a>","tim_cook",675,FALSE,FALSE,NA,NA
"Congratulations #Duke and @DavidCutcliffe. Terrific win in the #PinstripeBowl!",FALSE,928,NA,2015-12-27 00:29:31,FALSE,NA,"680908332635426816",NA,"<a href=""http://twitter.com/download/iphone"" rel=""nofollow"">Twitter for iPhone</a>","tim_cook",284,FALSE,FALSE,NA,NA
"Peace on earth. Wishing everyone a joyous holiday season. May all of your dreams come to be. #HappyHolidays  https://t.co/8nq4xth9Xp",FALSE,3054,NA,2015-12-25 15:27:23,FALSE,NA,"680409509584596992",NA,"<a href=""http://twitter.com/download/iphone"" rel=""nofollow"">Twitter for iPhone</a>","tim_cook",1041,FALSE,FALSE,NA,NA
"Stunning iPhone photography by White House chief official photog @petesouza  https://t.co/yyzNDh1zzV",FALSE,2305,NA,2015-12-22 23:03:27,FALSE,NA,"679437119471812608",NA,"<a href=""http://twitter.com/download/iphone"" rel=""nofollow"">Twitter for iPhone</a>","tim_cook",1103,FALSE,FALSE,NA,NA
"An important moment in the fight against climate change. Government can't do it alone. Apple is committed to clean energy  #COP21",FALSE,3193,NA,2015-12-12 23:27:50,FALSE,NA,"675819377594273797",NA,"<a href=""http://twitter.com/#!/download/ipad"" rel=""nofollow"">Twitter for iPad</a>","tim_cook",1242,FALSE,FALSE,NA,NA
"Thanks @AndraDayMusic for a spectacular holiday performance at Apple today. Best of luck at the Grammys! https://t.co/MtZflrtr6b",FALSE,1400,NA,2015-12-12 02:11:32,FALSE,NA,"675498188619448320",NA,"<a href=""http://twitter.com/download/iphone"" rel=""nofollow"">Twitter for iPhone</a>","tim_cook",335,FALSE,FALSE,NA,NA
"Just met coders of tomorrow from NY's PS 57. #hourofcode workshops at all Apple stores tomorrow. https://t.co/xDsJr9g6xk",FALSE,1775,NA,2015-12-09 20:54:36,FALSE,NA,"674693651101032448",NA,"<a href=""http://twitter.com/download/iphone"" rel=""nofollow"">Twitter for iPhone</a>","tim_cook",547,FALSE,FALSE,NA,NA
"Inclusion inspires innovation and communication is the key. Start with Hi and take time to learn more #JustSayHi https://t.co/u3x9RTh8QR",FALSE,1359,NA,2015-12-08 13:44:25,FALSE,NA,"674223004671348736",NA,"<a href=""http://twitter.com/#!/download/ipad"" rel=""nofollow"">Twitter for iPad</a>","tim_cook",675,FALSE,FALSE,NA,NA
"Around the world, Apple stores are going (RED) to show our support and help raise awareness for #WorldAIDSDay https://t.co/gpX4rLVNwt",FALSE,3820,NA,2015-12-01 20:49:10,FALSE,NA,"671793179767672834",NA,"<a href=""http://twitter.com/#!/download/ipad"" rel=""nofollow"">Twitter for iPad</a>","tim_cook",1748,FALSE,FALSE,NA,NA
"Couldn't be prouder of @FootballAU. Great to be back in Auburn and meet amazing alums  @BringerOfRain20 @BoJackson https://t.co/nxpJ6uAgyv",FALSE,2249,NA,2015-11-29 15:39:33,FALSE,NA,"670990488225357824",NA,"<a href=""http://twitter.com/#!/download/ipad"" rel=""nofollow"">Twitter for iPad</a>","tim_cook",678,FALSE,FALSE,NA,NA
"Happy Thanksgiving to all! Deeply grateful this #Thanksgiving to be a part of the Apple community and for family, friends, and freedom.",FALSE,3473,NA,2015-11-26 15:35:34,FALSE,NA,"669902324010106880",NA,"<a href=""http://twitter.com/#!/download/ipad"" rel=""nofollow"">Twitter for iPad</a>","tim_cook",1078,FALSE,FALSE,NA,NA
"Prayers for Paris, the victims and their loved ones. Nous sommes tous Parisiens.",FALSE,9508,NA,2015-11-14 00:57:22,FALSE,NA,"665332660479242241",NA,"<a href=""http://twitter.com/download/iphone"" rel=""nofollow"">Twitter for iPhone</a>","tim_cook",6640,FALSE,FALSE,NA,NA
"Thank you Robert for being one of our very first iPad Pro customers at the Apple Store, Princes Street, Edinburgh. https://t.co/l522Ddccbu",FALSE,2904,NA,2015-11-12 20:00:42,FALSE,NA,"664895613201473536",NA,"<a href=""http://twitter.com/download/iphone"" rel=""nofollow"">Twitter for iPhone</a>","tim_cook",723,FALSE,FALSE,NA,NA
"Caught up with our world-class team in Cork today. Thanks, Ireland, for a great visit! https://t.co/jVoTEmoFWJ",FALSE,2441,NA,2015-11-11 22:28:28,FALSE,NA,"664570416044875776",NA,"<a href=""http://twitter.com/download/iphone"" rel=""nofollow"">Twitter for iPhone</a>","tim_cook",726,FALSE,FALSE,NA,NA
"Such a privilege to share this day with @tcdphil. Thanks to everyone at @tcddublin for a great morning. https://t.co/xtz9YNCuWM",FALSE,1533,NA,2015-11-11 16:43:14,FALSE,NA,"664483533503639552",NA,"<a href=""http://twitter.com/#!/download/ipad"" rel=""nofollow"">Twitter for iPad</a>","tim_cook",417,FALSE,FALSE,NA,NA
"We honor the brave military men and women who have fought for our freedoms, and their families. Thank you for your service and sacrifice.",FALSE,2061,NA,2015-11-11 09:38:57,FALSE,NA,"664376760482570240",NA,"<a href=""http://twitter.com/download/iphone"" rel=""nofollow"">Twitter for iPhone</a>","tim_cook",872,FALSE,FALSE,NA,NA
"Thanks @Unibocconi for the warm welcome.  In bocca al lupo a tutti gli studenti per questo nuovo anno accademico! https://t.co/d4ZTGGVqpM",FALSE,1425,NA,2015-11-10 14:49:02,FALSE,NA,"664092406883753984",NA,"<a href=""http://twitter.com/download/iphone"" rel=""nofollow"">Twitter for iPhone</a>","tim_cook",654,FALSE,FALSE,NA,NA
"Amazing what @Touchpress is doing with classical music on #iPadPro and #AppleTV -great visit at their London office https://t.co/T8mowQIoBo",FALSE,1286,NA,2015-11-09 16:09:36,FALSE,NA,"663750294837178368",NA,"<a href=""http://twitter.com/download/iphone"" rel=""nofollow"">Twitter for iPhone</a>","tim_cook",437,FALSE,FALSE,NA,NA
"The Tigers are back! Congratulations @CoachGusMalzahn @auburnqb6 @CoachWMuschamp Jovan Robinson! The best is yet to come!",FALSE,1792,NA,2015-11-08 04:11:30,FALSE,NA,"663207190702911488",NA,"<a href=""http://twitter.com/download/iphone"" rel=""nofollow"">Twitter for iPhone</a>","tim_cook",870,FALSE,FALSE,NA,NA
"Leaving the world better than we found it: 2 gigawatts of renewable energy for manufacturing in China by 2020.  https://t.co/LYuRiejUtV",FALSE,1587,NA,2015-10-22 03:50:16,FALSE,NA,"657041251011694592",NA,"<a href=""http://twitter.com/#!/download/ipad"" rel=""nofollow"">Twitter for iPad</a>","tim_cook",785,FALSE,FALSE,NA,NA
"RT @laurenepowell: Thank you @waltmossberg for caring about the difference between fact and fiction https://t.co/vh81Su7Dzk",FALSE,0,NA,2015-10-21 22:03:05,FALSE,NA,"656953881373577221",NA,"<a href=""http://twitter.com/#!/download/ipad"" rel=""nofollow"">Twitter for iPad</a>","tim_cook",1271,TRUE,FALSE,NA,NA
