"text","favorited","favoriteCount","replyToSN","created","truncated","replyToSID","id","replyToUID","statusSource","screenName","retweetCount","isRetweet","retweeted","longitude","latitude"
"It was great to meet you, Alex! Looking forward to seeing you at WWDC 2018! @TheAbilityApp @TheEllenShow https://t.co/dFHI7WLAHQ",FALSE,6733,NA,2017-09-20 18:47:51,FALSE,NA,"910576253354291201",NA,"<a href=""http://twitter.com/download/iphone"" rel=""nofollow"">Twitter for iPhone</a>","tim_cook",1138,FALSE,FALSE,NA,NA
"Nuestros pensamientos están con todos los afectados por el terremoto que sufrió México hoy. Rezando por nuestros amigos y colegas. <U+0001F1F2><U+0001F1FD>",FALSE,35144,NA,2017-09-19 23:50:22,FALSE,NA,"910289999786123266",NA,"<a href=""http://twitter.com/download/iphone"" rel=""nofollow"">Twitter for iPhone</a>","tim_cook",10757,FALSE,FALSE,NA,NA
"It's a big day at Apple! We are honored and thrilled to host our first keynote at the Steve Jobs Theater this morni… https://t.co/dtB76zXt7K",FALSE,53231,NA,2017-09-12 15:11:43,TRUE,NA,"907622761786253312",NA,"<a href=""http://twitter.com/download/iphone"" rel=""nofollow"">Twitter for iPhone</a>","tim_cook",15635,FALSE,FALSE,NA,NA
"Our thoughts and prayers are with those affected by #Irma. Please stay safe! Apple is proud to support #HandInHand. https://t.co/BYJ6qPWh4p",FALSE,3841,NA,2017-09-08 22:08:59,FALSE,NA,"906278215282393088",NA,"<a href=""http://twitter.com"" rel=""nofollow"">Twitter Web Client</a>","tim_cook",801,FALSE,FALSE,NA,NA
"Powerful stories, striking portraits! Bravo @TIME and Luisa Dorr #ShotoniPhone #SheIsTheFirst https://t.co/i5hS8IFgE8",FALSE,1821,NA,2017-09-07 22:46:56,FALSE,NA,"905925379575078915",NA,"<a href=""http://twitter.com"" rel=""nofollow"">Twitter Web Client</a>","tim_cook",421,FALSE,FALSE,NA,NA
"#Dreamers contribute to our companies and our communities just as much as you and I. Apple will fight for them to be treated as equals.",FALSE,36904,NA,2017-09-05 18:33:23,FALSE,NA,"905136795645501440",NA,"<a href=""http://twitter.com/download/iphone"" rel=""nofollow"">Twitter for iPhone</a>","tim_cook",12167,FALSE,FALSE,NA,NA
"250 of my Apple coworkers are #Dreamers. I stand with them. They deserve our respect as equals and a solution rooted in American values.",FALSE,148138,NA,2017-09-03 12:38:13,FALSE,NA,"904322640654897152",NA,"<a href=""http://twitter.com/download/iphone"" rel=""nofollow"">Twitter for iPhone</a>","tim_cook",51681,FALSE,FALSE,NA,NA
"Prayers for Texas and all those affected by #HurricaneHarvey. Join us in the relief effort by donating: https://t.co/QLBMFOjaDG",FALSE,5017,NA,2017-08-27 13:01:47,FALSE,NA,"901791855108530176",NA,"<a href=""http://twitter.com/#!/download/ipad"" rel=""nofollow"">Twitter for iPad</a>","tim_cook",1353,FALSE,FALSE,NA,NA
"Saluting the incredible women at Apple, and around the world, who are leading the way to a better future. #WomensEqualityDay",FALSE,9700,NA,2017-08-26 20:06:21,FALSE,NA,"901536314729701376",NA,"<a href=""http://twitter.com/download/iphone"" rel=""nofollow"">Twitter for iPhone</a>","tim_cook",2080,FALSE,FALSE,NA,NA
"Thanks to all my friends in Texas, new and old, for another amazing visit! Please stay safe as the storm comes ashore.",FALSE,3924,NA,2017-08-25 21:04:30,FALSE,NA,"901188560774213633",NA,"<a href=""http://twitter.com/download/iphone"" rel=""nofollow"">Twitter for iPhone</a>","tim_cook",466,FALSE,FALSE,NA,NA
"Visiting our great customers and employees today at Apple The Domain was a treat. Apple <U+2764><U+FE0F> Austin! Thanks for 25 fa… https://t.co/xrACHz6kvj",FALSE,3794,NA,2017-08-25 20:38:45,TRUE,NA,"901182077625880576",NA,"<a href=""http://twitter.com/download/iphone"" rel=""nofollow"">Twitter for iPhone</a>","tim_cook",460,FALSE,FALSE,NA,NA
"Apple has the best customer service because we have the best people. Thrilled to see #AppleCare advisors in action… https://t.co/Z05xt1GMK2",FALSE,5663,NA,2017-08-25 20:07:00,TRUE,NA,"901174088558944257",NA,"<a href=""http://twitter.com/download/iphone"" rel=""nofollow"">Twitter for iPhone</a>","tim_cook",795,FALSE,FALSE,NA,NA
"Everyone deserves equal access to a great education. Proud to stand w/@accdistrict to launch our App Development wi… https://t.co/XCYqRQ23FD",FALSE,2257,NA,2017-08-25 19:42:57,TRUE,NA,"901168036216025091",NA,"<a href=""http://twitter.com/download/iphone"" rel=""nofollow"">Twitter for iPhone</a>","tim_cook",414,FALSE,FALSE,NA,NA
"Thx @JoshuaBaer for a fantastic morning @CapitalFactory. Developer creativity is off the charts. We’re as excited a… https://t.co/iX0XpCuTgH",FALSE,1978,NA,2017-08-25 19:34:15,TRUE,NA,"901165846395056129",NA,"<a href=""http://twitter.com/download/iphone"" rel=""nofollow"">Twitter for iPhone</a>","tim_cook",341,FALSE,FALSE,NA,NA
"Great day in the Hawkeye State! A shout out to the dedicated team at Apple Jordan Creek. https://t.co/94b1nHztCA",FALSE,3127,NA,2017-08-24 21:03:01,FALSE,NA,"900825796952158208",NA,"<a href=""http://twitter.com/download/iphone"" rel=""nofollow"">Twitter for iPhone</a>","tim_cook",373,FALSE,FALSE,NA,NA
".@WaukeeAPEX thanks for showing me around! Loved seeing the collaboration among students and depth of learning at y… https://t.co/SoFKk9ix4z",FALSE,1767,NA,2017-08-24 21:00:55,TRUE,NA,"900825268759261186",NA,"<a href=""http://twitter.com/download/iphone"" rel=""nofollow"">Twitter for iPhone</a>","tim_cook",260,FALSE,FALSE,NA,NA
"@WaukeeAPEX thanks for showing me around! Loved seeing the collaboration among students and depth of learning at yo… https://t.co/7wcmwoCnTz",FALSE,106,"WaukeeAPEX",2017-08-24 20:45:52,TRUE,NA,"900821484201025536","2516974363","<a href=""http://twitter.com/download/iphone"" rel=""nofollow"">Twitter for iPhone</a>","tim_cook",22,FALSE,FALSE,NA,NA
"Looking forward to working with @KimReynoldsIA &amp; @CityofWaukee for Apple's newest data center to serve N American c… https://t.co/mSkilLL9M1",FALSE,2043,NA,2017-08-24 19:46:43,TRUE,NA,"900806597395578880",NA,"<a href=""http://twitter.com/download/iphone"" rel=""nofollow"">Twitter for iPhone</a>","tim_cook",352,FALSE,FALSE,NA,NA
"Thanks to the team at CTS in Cincinnati, manufacturers of best-in-class testing equipment for Apple. Enjoyed my vis… https://t.co/IWqzPAHZS9",FALSE,3789,NA,2017-08-24 14:42:38,TRUE,NA,"900730071178248192",NA,"<a href=""http://twitter.com/download/iphone"" rel=""nofollow"">Twitter for iPhone</a>","tim_cook",643,FALSE,FALSE,NA,NA
"Our hearts are with the families and loved ones of those lost aboard the #USSJohnSMcCain, and all the brave men and women who serve.",FALSE,3555,NA,2017-08-22 13:39:15,FALSE,NA,"899989346459070465",NA,"<a href=""http://twitter.com/download/iphone"" rel=""nofollow"">Twitter for iPhone</a>","tim_cook",537,FALSE,FALSE,NA,NA
"Ataques trágicos y sin sentido en Barcelona. Nuestros pensamientos están hoy con todos nuestros amigos y compañeros en esa gran ciudad.",FALSE,20910,NA,2017-08-17 18:03:02,FALSE,NA,"898243787016650752",NA,"<a href=""http://twitter.com/download/iphone"" rel=""nofollow"">Twitter for iPhone</a>","tim_cook",7077,FALSE,FALSE,NA,NA
"We’ve seen the terror of white supremacy &amp; racist violence before. It's a moral issue - an affront to America. We must all stand against it",FALSE,22998,NA,2017-08-14 16:11:13,FALSE,NA,"897128485843382277",NA,"<a href=""http://twitter.com/download/iphone"" rel=""nofollow"">Twitter for iPhone</a>","tim_cook",6136,FALSE,FALSE,NA,NA
"Heartbreaking scenes in #Charlottesville. Violence and racism have no place in America.",FALSE,14641,NA,2017-08-12 22:59:12,FALSE,NA,"896506383968870400",NA,"<a href=""http://twitter.com/download/iphone"" rel=""nofollow"">Twitter for iPhone</a>","tim_cook",3716,FALSE,FALSE,NA,NA
"Thanks @ddlovato for helping us celebrate diversity and showing the world what it means to have courage and heart! https://t.co/UXUoUsm5TA",FALSE,21438,NA,2017-08-05 01:29:01,FALSE,NA,"893644983017676801",NA,"<a href=""http://twitter.com/download/iphone"" rel=""nofollow"">Twitter for iPhone</a>","tim_cook",4383,FALSE,FALSE,NA,NA
"An #accessibility breakthrough for people with hearing loss. Proud of our team's work with @CochlearUS https://t.co/YJguB6WC21 @WIRED",FALSE,2996,NA,2017-08-03 02:29:47,FALSE,NA,"892935498129301504",NA,"<a href=""http://twitter.com/download/iphone"" rel=""nofollow"">Twitter for iPhone</a>","tim_cook",972,FALSE,FALSE,NA,NA
"We are indebted to all who serve. Discrimination against anyone holds everyone back. #LetThemServe",FALSE,23395,NA,2017-07-26 19:00:36,FALSE,NA,"890285745092444160",NA,"<a href=""http://twitter.com/download/iphone"" rel=""nofollow"">Twitter for iPhone</a>","tim_cook",7018,FALSE,FALSE,NA,NA
"A salute to the bright minds of our 2017 interns. Thank you for your contributions and enjoy the rest of the summer! https://t.co/vqRLDaBvgv",FALSE,3670,NA,2017-07-22 01:13:37,FALSE,NA,"888567676502659072",NA,"<a href=""http://twitter.com/download/iphone"" rel=""nofollow"">Twitter for iPhone</a>","tim_cook",441,FALSE,FALSE,NA,NA
"<U+0001F600><U+0001F30E><U+0001F30D><U+0001F30F><U+0001F4C6> Happy #WorldEmojiDay! <U+0001F389> We’ve got some <U+0001F60E> new ones to show you, coming later this year! <U+0001F440><U+0001F447>… https://t.co/SW4CBdYsoc",FALSE,25160,NA,2017-07-17 15:09:32,TRUE,NA,"886966103531900928",NA,"<a href=""http://twitter.com/download/iphone"" rel=""nofollow"">Twitter for iPhone</a>","tim_cook",11997,FALSE,FALSE,NA,NA
"Join me in celebrating National Parks today! Complete a 3.5 mile walk/run/roll workout with your Apple Watch and ea… https://t.co/rrH4GLBBaQ",FALSE,5083,NA,2017-07-15 21:12:36,TRUE,NA,"886332695227228160",NA,"<a href=""http://twitter.com/download/iphone"" rel=""nofollow"">Twitter for iPhone</a>","tim_cook",717,FALSE,FALSE,NA,NA
"Saddened by the tragic loss of life in Mississippi. Our prayers are with the families and all those who serve.",FALSE,5566,NA,2017-07-11 04:17:22,FALSE,NA,"884627650181906432",NA,"<a href=""http://twitter.com/download/iphone"" rel=""nofollow"">Twitter for iPhone</a>","tim_cook",947,FALSE,FALSE,NA,NA
"Wishing everyone a happy #Independence Day! <U+0001F1FA><U+0001F1F8> “Remember always that all of us ... are descended from immigrants and revolutionists.” -FDR",FALSE,20659,NA,2017-07-04 12:48:46,FALSE,NA,"882219636816609280",NA,"<a href=""http://twitter.com/download/iphone"" rel=""nofollow"">Twitter for iPhone</a>","tim_cook",6609,FALSE,FALSE,NA,NA
"Happy #CanadaDay to everyone celebrating! / Bonne #FêteDuCanada à tous ceux qui célèbrent! <U+0001F1E8><U+0001F1E6>",FALSE,4121,NA,2017-07-01 17:56:38,FALSE,NA,"881209949543641091",NA,"<a href=""http://twitter.com/download/iphone"" rel=""nofollow"">Twitter for iPhone</a>","tim_cook",673,FALSE,FALSE,NA,NA
"@MichelGondry Here's Détour, #shotoniphone by @MichelGondry, with English subtitles. https://t.co/AH91NdDEd6",FALSE,834,"tim_cook",2017-07-01 14:26:13,FALSE,"881155119634665476","881156995071586306","1636590253","<a href=""http://twitter.com/#!/download/ipad"" rel=""nofollow"">Twitter for iPad</a>","tim_cook",203,FALSE,FALSE,NA,NA
"Love this new short film by @MichelGondry #shotoniphone. Vive le cinéma français. <U+0001F1EB><U+0001F1F7>
https://t.co/VsYyvgXljN",FALSE,1990,NA,2017-07-01 14:18:46,FALSE,NA,"881155119634665476",NA,"<a href=""http://twitter.com/#!/download/ipad"" rel=""nofollow"">Twitter for iPad</a>","tim_cook",593,FALSE,FALSE,NA,NA
"National Parks are some of my favorite places on earth. Proud to work with @GoParks on preserving these treasures! https://t.co/p98m6pSbs6",FALSE,4095,NA,2017-06-30 14:33:10,FALSE,NA,"880796356457136129",NA,"<a href=""http://twitter.com/download/iphone"" rel=""nofollow"">Twitter for iPhone</a>","tim_cook",821,FALSE,FALSE,NA,NA
"Here's to the #iPhone that changed the world, to the man who dreamed it &amp; the people at Apple who have never stoppe… https://t.co/sEBaN4wK7C",FALSE,37757,NA,2017-06-29 16:41:04,TRUE,NA,"880466154019356672",NA,"<a href=""http://twitter.com/download/iphone"" rel=""nofollow"">Twitter for iPhone</a>","tim_cook",15608,FALSE,FALSE,NA,NA
"Celebrating Canadian optimism &amp; diversity / Célébrons l’optimisme et la diversité du Canada <U+0001F1E8><U+0001F1E6> #shotoniphone https://t.co/h4IOsKniuG",FALSE,2592,NA,2017-06-28 21:00:12,FALSE,NA,"880168981486632960",NA,"<a href=""http://twitter.com/download/iphone"" rel=""nofollow"">Twitter for iPhone</a>","tim_cook",708,FALSE,FALSE,NA,NA
"Thanks @ChuckRobbins for hosting me today. Key features and security advancements for business in iOS 11 and throug… https://t.co/tbUjXd3d29",FALSE,2473,NA,2017-06-26 21:21:53,TRUE,NA,"879449662696050688",NA,"<a href=""http://twitter.com/download/iphone"" rel=""nofollow"">Twitter for iPhone</a>","tim_cook",456,FALSE,FALSE,NA,NA
"Great to see you again @narendramodi. We’re inspired by your vision for India and excited about what we can achieve… https://t.co/DeMsvDFy5F",FALSE,20961,NA,2017-06-26 16:41:53,TRUE,NA,"879379198913069056",NA,"<a href=""http://twitter.com/download/iphone"" rel=""nofollow"">Twitter for iPhone</a>","tim_cook",6843,FALSE,FALSE,NA,NA
"Happy #Pride2017 to all our employees, their families and customers around the world! Today we're showing… https://t.co/qvNZQQANnz",FALSE,9844,NA,2017-06-25 22:19:28,TRUE,NA,"879101766729650176",NA,"<a href=""http://twitter.com/download/iphone"" rel=""nofollow"">Twitter for iPhone</a>","tim_cook",2171,FALSE,FALSE,NA,NA
"Eid Mubarak to everyone celebrating around the world! Wishing you and your loved ones peace, joy and prosperity.",FALSE,19711,NA,2017-06-24 01:16:11,FALSE,NA,"878421460217249793",NA,"<a href=""http://twitter.com/download/iphone"" rel=""nofollow"">Twitter for iPhone</a>","tim_cook",9222,FALSE,FALSE,NA,NA
"Moving visit to the American Veterans Disabled for Life Monument. “In war, there are no unwounded soldiers.” Thank… https://t.co/LHjBqrz9gA",FALSE,2810,NA,2017-06-21 02:04:48,TRUE,NA,"877346532017811456",NA,"<a href=""http://twitter.com/download/iphone"" rel=""nofollow"">Twitter for iPhone</a>","tim_cook",393,FALSE,FALSE,NA,NA
"Our hearts are with you, London. <U+0001F1EC><U+0001F1E7> “Hate, it has caused a lot of problems in the world, but has not solved one yet.” -M. Angelou",FALSE,7054,NA,2017-06-19 17:02:28,FALSE,NA,"876847663886594048",NA,"<a href=""http://twitter.com/download/iphone"" rel=""nofollow"">Twitter for iPhone</a>","tim_cook",1644,FALSE,FALSE,NA,NA
"To all the fathers I'm privileged to know and work with, and to dads everywhere, Happy #FathersDay!",FALSE,6835,NA,2017-06-18 15:17:30,FALSE,NA,"876458858683576320",NA,"<a href=""http://twitter.com/download/iphone"" rel=""nofollow"">Twitter for iPhone</a>","tim_cook",945,FALSE,FALSE,NA,NA
"Enjoy your new iPad Pro @austinmann! We're thrilled with the feedback we're getting from creative pros and customer… https://t.co/Vzib4FAjdc",FALSE,2928,NA,2017-06-14 22:29:51,TRUE,NA,"875118111925559296",NA,"<a href=""http://twitter.com"" rel=""nofollow"">Twitter Web Client</a>","tim_cook",365,FALSE,FALSE,NA,NA
"Saddened by the terrifying events in Virginia. Our prayers are with all those affected. Such violence has no place in America - or anywhere.",FALSE,4607,NA,2017-06-14 14:05:47,FALSE,NA,"874991261026967554",NA,"<a href=""http://twitter.com/download/iphone"" rel=""nofollow"">Twitter for iPhone</a>","tim_cook",912,FALSE,FALSE,NA,NA
"Here comes Apple Taipei 101, our first store in Taiwan! <U+6709><U+9592><U+4F86><U+5750>! https://t.co/hniIt9K3Xa",FALSE,9399,NA,2017-06-11 20:54:44,FALSE,NA,"874007011087732737",NA,"<a href=""http://twitter.com"" rel=""nofollow"">Twitter Web Client</a>","tim_cook",2534,FALSE,FALSE,NA,NA
"Thanks @RedSox &amp; #redsoxnation for capping a fun day in Boston! #WinDanceRepeat https://t.co/DvhPV2tVrK",FALSE,2519,NA,2017-06-10 03:16:02,FALSE,NA,"873378191217504257",NA,"<a href=""http://twitter.com/download/iphone"" rel=""nofollow"">Twitter for iPhone</a>","tim_cook",385,FALSE,FALSE,NA,NA
"Great to be back at Apple Boylston Street visiting our incredible team and customers today! https://t.co/XeeWtG2Bc5",FALSE,3130,NA,2017-06-09 22:46:00,FALSE,NA,"873310238383931393",NA,"<a href=""http://twitter.com/download/iphone"" rel=""nofollow"">Twitter for iPhone</a>","tim_cook",374,FALSE,FALSE,NA,NA
"Congratulations, @MIT class of 2017! Today, all of humanity has good cause for hope. https://t.co/10g3f7ZbDd",FALSE,5523,NA,2017-06-09 19:19:04,FALSE,NA,"873258159657365505",NA,"<a href=""http://twitter.com/download/iphone"" rel=""nofollow"">Twitter for iPhone</a>","tim_cook",897,FALSE,FALSE,NA,NA
"Hope everyone had a great week at WWDC! Developers, we can't wait to see what you create next. Already looking forw… https://t.co/1Rn9oPnjAp",FALSE,4453,NA,2017-06-09 13:50:32,TRUE,NA,"873175482220544000",NA,"<a href=""http://twitter.com/download/iphone"" rel=""nofollow"">Twitter for iPhone</a>","tim_cook",811,FALSE,FALSE,NA,NA
"So impressed by @MIT students &amp; faculty who are finding new ways to tackle the world’s biggest challenges. Thanks f… https://t.co/MnhgKJjira",FALSE,4172,NA,2017-06-08 23:31:43,TRUE,NA,"872959355301355520",NA,"<a href=""http://twitter.com/download/iphone"" rel=""nofollow"">Twitter for iPhone</a>","tim_cook",704,FALSE,FALSE,NA,NA
"Thank you  @MichelleObama for sharing your views on diversity &amp; innovation, and for encouraging developers to make… https://t.co/2oBBL4N8yz",FALSE,12076,NA,2017-06-06 21:51:24,TRUE,NA,"872209331810295809",NA,"<a href=""http://twitter.com"" rel=""nofollow"">Twitter Web Client</a>","tim_cook",2647,FALSE,FALSE,NA,NA
"A huge day of exciting announcements at WWDC yesterday! We’re back for Day 2 - have a great week, developers! https://t.co/CyQLWoVfNl",FALSE,4836,NA,2017-06-06 15:02:04,FALSE,NA,"872106320400338945",NA,"<a href=""http://twitter.com/download/iphone"" rel=""nofollow"">Twitter for iPhone</a>","tim_cook",731,FALSE,FALSE,NA,NA
"Just a few more hours to go, developers! We've got a big week ahead. See you at the keynote! #WWDC17 https://t.co/ewnOg3dXQ5",FALSE,11039,NA,2017-06-05 13:46:03,FALSE,NA,"871724803920625664",NA,"<a href=""http://twitter.com"" rel=""nofollow"">Twitter Web Client</a>","tim_cook",3640,FALSE,FALSE,NA,NA
"Kicking off #WWDC17 with this year's talented scholarship recipients. See you all tomorrow morning! https://t.co/4kovS1cAzX",FALSE,5592,NA,2017-06-04 23:44:41,FALSE,NA,"871513064088064000",NA,"<a href=""http://twitter.com/download/iphone"" rel=""nofollow"">Twitter for iPhone</a>","tim_cook",1033,FALSE,FALSE,NA,NA
"Shocked by more senseless attacks in London. Our hearts go out to our friends, coworkers, neighbors and everyone in that great city. <U+0001F1EC><U+0001F1E7>",FALSE,11983,NA,2017-06-04 00:41:45,FALSE,NA,"871165041289998336",NA,"<a href=""http://twitter.com/download/iphone"" rel=""nofollow"">Twitter for iPhone</a>","tim_cook",2472,FALSE,FALSE,NA,NA
"Decision to withdraw from the #ParisAgreeement was wrong for our planet. Apple is committed to fight climate change and we will never waver.",FALSE,39820,NA,2017-06-02 00:36:46,FALSE,NA,"870439008316276736",NA,"<a href=""http://twitter.com/#!/download/ipad"" rel=""nofollow"">Twitter for iPad</a>","tim_cook",14305,FALSE,FALSE,NA,NA
"A tremendous milestone for our developers who create the very best apps &amp; games for our customers around the world https://t.co/DCVzC1FxEG",FALSE,2674,NA,2017-06-01 14:35:31,FALSE,NA,"870287701043433472",NA,"<a href=""http://twitter.com"" rel=""nofollow"">Twitter Web Client</a>","tim_cook",685,FALSE,FALSE,NA,NA
"“The human mind is our fundamental resource.” On #JFK's 100th birthday, we celebrate his legacy by learning. https://t.co/pzMEwp9pUY",FALSE,2114,NA,2017-05-29 16:42:37,FALSE,NA,"869232521266946048",NA,"<a href=""http://twitter.com/download/iphone"" rel=""nofollow"">Twitter for iPhone</a>","tim_cook",594,FALSE,FALSE,NA,NA
"We honor the heroes who gave their lives for our freedom. They and their families have our eternal gratitude #MemorialDay",FALSE,4180,NA,2017-05-29 14:15:35,FALSE,NA,"869195521457479682",NA,"<a href=""http://twitter.com"" rel=""nofollow"">Twitter Web Client</a>","tim_cook",882,FALSE,FALSE,NA,NA
"Heartbroken at the passing of @GreggAllman I grew up listening to your soulful voice &amp; will never forget you. RIP midnight rider.",FALSE,2889,NA,2017-05-27 22:31:35,FALSE,NA,"868595567072387072",NA,"<a href=""http://twitter.com"" rel=""nofollow"">Twitter Web Client</a>","tim_cook",497,FALSE,FALSE,NA,NA
"Congratulations team, and thanks to the thousands of customers who joined us at the new #AppleOrchardRoad in Singap… https://t.co/DsjZNGPc7d",FALSE,3490,NA,2017-05-27 14:46:41,TRUE,NA,"868478569210462208",NA,"<a href=""http://twitter.com"" rel=""nofollow"">Twitter Web Client</a>","tim_cook",841,FALSE,FALSE,NA,NA
"""This was a risky drawing to make ... I kept worrying that the ball would hit me or the iPad."" @thejorgecolombo https://t.co/8PCMp7B1xL",FALSE,1240,NA,2017-05-26 13:31:51,FALSE,NA,"868097350765469697",NA,"<a href=""http://twitter.com/download/iphone"" rel=""nofollow"">Twitter for iPhone</a>","tim_cook",305,FALSE,FALSE,NA,NA
"Thrilled to be working with @HCCDistrict and other leading community colleges on new ways to teach app development!… https://t.co/uSgWraxO04",FALSE,1213,NA,2017-05-25 00:36:16,TRUE,NA,"867539778727591936",NA,"<a href=""http://twitter.com/download/iphone"" rel=""nofollow"">Twitter for iPhone</a>","tim_cook",314,FALSE,FALSE,NA,NA
"Deeply saddened by the tragic events in Manchester. Our thoughts are with everyone affected.  <U+0001F1EC><U+0001F1E7>",FALSE,9405,NA,2017-05-23 00:31:11,FALSE,NA,"866813724601876481",NA,"<a href=""http://twitter.com/download/iphone"" rel=""nofollow"">Twitter for iPhone</a>","tim_cook",2543,FALSE,FALSE,NA,NA
"Our stores are dedicated to educating, inspiring and enriching lives. https://t.co/83qrJUXMlm https://t.co/VI5p3kxVUu",FALSE,2499,NA,2017-05-21 13:31:20,FALSE,NA,"866285280675774465",NA,"<a href=""http://twitter.com/#!/download/ipad"" rel=""nofollow"">Twitter for iPad</a>","tim_cook",618,FALSE,FALSE,NA,NA
"We are indebted to all the courageous women &amp; men who serve our country, and the families who support them. Thank you! #ArmedForcesDay",FALSE,3282,NA,2017-05-20 13:06:20,FALSE,NA,"865916603757608961",NA,"<a href=""http://twitter.com/#!/download/ipad"" rel=""nofollow"">Twitter for iPad</a>","tim_cook",698,FALSE,FALSE,NA,NA
"Thank you to the incomparable Stevie Wonder for lifting hearts and celebrating accessibility with us! #GAAD https://t.co/WvePkgte5R",FALSE,4502,NA,2017-05-19 13:43:03,FALSE,NA,"865563452542074882",NA,"<a href=""http://twitter.com/#!/download/ipad"" rel=""nofollow"">Twitter for iPad</a>","tim_cook",792,FALSE,FALSE,NA,NA
"Thanks @JamesRath @PintSzDiva @RikkiPoynter for visiting Apple for #GAAD! Great conversations about the importance… https://t.co/SKwx5qDMu5",FALSE,1763,NA,2017-05-18 02:13:08,TRUE,NA,"865027444041932801",NA,"<a href=""http://twitter.com/download/iphone"" rel=""nofollow"">Twitter for iPhone</a>","tim_cook",393,FALSE,FALSE,NA,NA
"Happy #MothersDay to moms everywhere! ""Behind all your stories is always your mother's story, because hers is where yours begins."" -M. Albom",FALSE,5459,NA,2017-05-14 16:32:36,FALSE,NA,"863794182950756352",NA,"<a href=""http://twitter.com/download/iphone"" rel=""nofollow"">Twitter for iPhone</a>","tim_cook",1309,FALSE,FALSE,NA,NA
"Gorgeous store, phenomenal team! Thanks to everyone who came out to see the new Apple Dubai Mall. https://t.co/LR2MXsqKE3",FALSE,2864,NA,2017-04-28 01:30:43,FALSE,NA,"857769010028359680",NA,"<a href=""http://twitter.com"" rel=""nofollow"">Twitter Web Client</a>","tim_cook",671,FALSE,FALSE,NA,NA
"Happy #EarthDay! Get outside, enjoy our planet and complete a 30-minute workout today to earn a special badge on Ap… https://t.co/BCg8ehVArz",FALSE,6916,NA,2017-04-22 14:21:03,TRUE,NA,"855788546413576192",NA,"<a href=""http://twitter.com/download/iphone"" rel=""nofollow"">Twitter for iPhone</a>","tim_cook",1706,FALSE,FALSE,NA,NA
"We’re making progress toward a greener future. Our next goal: making products without mining new materials… https://t.co/ofdiIQGT2t",FALSE,6708,NA,2017-04-21 14:56:50,TRUE,NA,"855435161302781952",NA,"<a href=""http://twitter.com/download/iphone"" rel=""nofollow"">Twitter for iPhone</a>","tim_cook",2324,FALSE,FALSE,NA,NA
"Türkiye'de Ulusal Egemenlik ve Çocuk Bayrami’ni genç yeteneklerin çektigi müthis fotograflarla kutluyoruz. #23Nisan… https://t.co/MokrHNkHH1",FALSE,18221,NA,2017-04-21 11:33:38,TRUE,NA,"855384024985985025",NA,"<a href=""http://twitter.com/download/iphone"" rel=""nofollow"">Twitter for iPhone</a>","tim_cook",7493,FALSE,FALSE,NA,NA
"In this season of renewal and hope, Happy Easter and wishes of peace for people everywhere.",FALSE,6901,NA,2017-04-16 12:35:30,FALSE,NA,"853587655161896961",NA,"<a href=""http://twitter.com/#!/download/ipad"" rel=""nofollow"">Twitter for iPad</a>","tim_cook",1336,FALSE,FALSE,NA,NA
"Timeless words from #42, ""The right of every American to first-class citizenship is the most important issue of our… https://t.co/N1D9SKpGVw",FALSE,3044,NA,2017-04-15 20:20:18,TRUE,NA,"853342236624302080",NA,"<a href=""http://twitter.com/#!/download/ipad"" rel=""nofollow"">Twitter for iPad</a>","tim_cook",947,FALSE,FALSE,NA,NA
"<U+0646><U+0639><U+0628><U+0650><U+0651><U+0631> <U+0639><U+0646> <U+0628><U+0627><U+0644><U+063A> <U+062D><U+0632><U+0646><U+0646><U+0627> <U+0648><U+0623><U+0633><U+0641><U+0646><U+0627> <U+062D><U+0648><U+0644> <U+0627><U+0644><U+062A><U+0641><U+062C><U+064A><U+0631><U+0627><U+062A> <U+0627><U+0644><U+0645><U+0631><U+0648><U+0639><U+0629> <U+0641><U+064A> <U+0645><U+0635><U+0631> <U+0648><U+0646><U+0639><U+0632><U+064A> <U+062C><U+0645><U+064A><U+0639> <U+0623><U+0647><U+0644><U+0647><U+0627><U+0001F1EA><U+0001F1EC>",FALSE,4555,NA,2017-04-09 20:37:19,FALSE,NA,"851172191215288321",NA,"<a href=""http://twitter.com"" rel=""nofollow"">Twitter Web Client</a>","tim_cook",2727,FALSE,FALSE,NA,NA
